{
  "name": "null-iv-demo",
  "design": "iv",
  "outcomes": [
    "y",
    "y_alt"
  ],
  "treatment": "d",
  "instruments_pool": [
    "z1",
    "z2",
    "z3"
  ],
  "instrument_policy": "all_subsets",
  "iv_estimators": [
    "2sls",
    "liml"
  ],
  "controls_pool": [
    "c1",
    "c2"
  ],
  "control_policy": "all_subsets",
  "fixed_effects": [
    [],
    [
      "grp"
    ]
  ],
  "vcov": [
    "hc1",
    "cluster"
  ],
  "cluster": [
    null,
    "grp"
  ],
  "outlier_rules": [
    "none",
    "sd3"
  ],
  "preregistered": {
    "outcome": "y",
    "instruments": [
      "z1",
      "z2",
      "z3"
    ],
    "iv_estimator": "2sls",
    "controls": [
      "c1",
      "c2"
    ],
    "fe": [
      "grp"
    ],
    "vcov": "cluster",
    "cluster": "grp",
    "outlier_rule": "none"
  },
  "notes": "Structural effect of d on y is exactly zero; d is endogenous; z3 is a weak instrument by construction."
}